mastercard_hidden_entrepreneur_artifacts/feature_summary_by_segment.csv

,txn_count,txn_count,total_amount,total_amount,avg_amount,avg_amount,median_amount,median_amount,max_amount,max_amount,std_amount,std_amount,unique_merchants,unique_merchants,top_merchant_ratio,top_merchant_ratio,unique_mcc,unique_mcc,avg_transaction_hour,avg_transaction_hour,night_activity_ratio,night_activity_ratio,weekend_activity_ratio,weekend_activity_ratio,online_ratio,online_ratio,tokenized_ratio,tokenized_ratio,recurring_ratio,recurring_ratio,international_ratio,international_ratio,unique_countries,unique_countries,avg_txn_per_day,avg_txn_per_day,recurring_capable_ratio,recurring_capable_ratio
,mean,median,mean,median,mean,median,mean,median,mean,median,mean,median,mean,median,mean,median,mean,median,mean,median,mean,median,mean,median,mean,median,mean,median,mean,median,mean,median,mean,median,mean,median,mean,median
consumer,122.9061,120.0,6642511.7084,2976294.0,54770.1359,26774.9452,23119.4511,9673.5,736432.4695,373106.5,99972.4602,52907.6736,36.7505,37.0,0.1607,0.1111,31.6828,32.0,14.9289,15.0417,0.0422,0.0323,0.3452,0.3502,0.4687,0.4472,0.3848,0.3855,0.0314,0.0,0.2503,0.2152,9.0478,9.0,0.6842,0.6685,0.074,0.0321
business,119.9037,119.0,18769161.7454,17714892.5,167642.4478,155609.8994,92225.2454,84558.5,1494760.4717,1204461.5,230146.5088,204449.419,17.0873,16.0,0.3678,0.3708,14.8488,15.0,11.6863,11.869,0.1653,0.1458,0.1291,0.1241,0.8484,0.8525,0.5846,0.5949,0.1547,0.1343,0.3122,0.2922,5.7397,5.0,0.6654,0.663,0.3363,0.2941

mastercard_hidden_entrepreneur_artifacts/business_report.md

## 9. Top feature importance

- `avg_transaction_hour`: consumer mean=14.9289, business mean=11.6863
- `online_ratio`: consumer mean=0.4687, business mean=0.8484
- `weekend_activity_ratio`: consumer mean=0.3452, business mean=0.1291
- `top_merchant_ratio`: consumer mean=0.1607, business mean=0.3678
- `tokenized_ratio`: consumer mean=0.3848, business mean=0.5846
- `recurring_ratio`: consumer mean=0.0314, business mean=0.1547
- `total_amount`: consumer mean=6642511.7084, business mean=18769161.7454
- `recurring_capable_ratio`: consumer mean=0.0740, business mean=0.3363